{
  "id": "couple-and-family-psychology",
  "record_type": "entity",
  "entity_type": "subfield",
  "name": "Couple and Family Psychology",
  "aliases": [],
  "status": "retrieved",
  "publishable": false,
  "provenance": "reference_system",
  "source_ids": ["apa-coa-implementing-regulations-section-c"],
  "tags": []
}
