{
  "id": "social-and-affective-neuroscience",
  "record_type": "entity",
  "entity_type": "subfield",
  "name": "Social and affective neuroscience",
  "aliases": [],
  "status": "retrieved",
  "publishable": false,
  "provenance": "reference_system",
  "source_ids": ["abs-anzsrc-2020-for-data-cube"],
  "tags": []
}
