{
  "id": "clinical-and-community-psychology",
  "record_type": "entity",
  "entity_type": "subfield",
  "name": "Clinical and Community Psychology",
  "aliases": [],
  "status": "retrieved",
  "publishable": false,
  "provenance": "reference_system",
  "source_ids": ["iaap-divisions-page"],
  "tags": [],
  "notes": "Preserves the compound IAAP organizational category; it does not assert equivalence between clinical and community psychology."
}
