{
  "id": "evolutionary-psychological-studies",
  "record_type": "entity",
  "entity_type": "subfield",
  "name": "Evolutionary psychological studies",
  "aliases": [],
  "status": "retrieved",
  "publishable": false,
  "provenance": "reference_system",
  "source_ids": ["abs-anzsrc-2020-for-data-cube"],
  "tags": [],
  "notes": "Preserves the ANZSRC field label; no equivalence to the broader or differently scoped term evolutionary psychology has been asserted."
}
