{
  "id": "aboriginal-and-torres-strait-islander-health-and-wellbeing",
  "record_type": "entity",
  "entity_type": "context_domain",
  "name": "Aboriginal and Torres Strait Islander health and wellbeing",
  "aliases": [],
  "status": "retrieved",
  "publishable": false,
  "provenance": "reference_system",
  "source_ids": ["abs-anzsrc-2020-for-data-cube", "arc-indigenous-studies-for-guide"],
  "tags": [],
  "notes": "ANZSRC Division 45 context domain explicitly covering physical, psychological, and spiritual wellbeing, health services, and biomedical and clinical sciences. It is directly relevant to Indigenous psychology but broader than psychology."
}
