{
  "id": "psychology-law-and-ethics",
  "record_type": "entity",
  "entity_type": "subfield",
  "name": "Psychology, Law and Ethics",
  "aliases": [],
  "status": "retrieved",
  "publishable": false,
  "provenance": "reference_system",
  "source_ids": ["iaap-divisions-page"],
  "tags": [],
  "notes": "Preserves the compound IAAP organizational category and remains distinct from the narrower Forensic Psychology identity."
}
