{
  "id": "clinical-and-health-psychology",
  "record_type": "entity",
  "entity_type": "subfield",
  "name": "Clinical and health psychology",
  "aliases": [],
  "status": "retrieved",
  "publishable": false,
  "provenance": "reference_system",
  "source_ids": ["abs-anzsrc-2020-for-data-cube"],
  "tags": [],
  "notes": "ANZSRC group identity; kept distinct from the narrower APA CoA specialty Clinical Health Psychology."
}
