{
  "id": "child-and-adolescent-development",
  "record_type": "entity",
  "entity_type": "subfield",
  "name": "Child and adolescent development",
  "aliases": [],
  "status": "retrieved",
  "publishable": false,
  "provenance": "reference_system",
  "source_ids": ["abs-anzsrc-2020-for-data-cube"],
  "tags": []
}
