{
  "id": "cognitive-and-computational-psychology",
  "record_type": "entity",
  "entity_type": "subfield",
  "name": "Cognitive and computational psychology",
  "aliases": [],
  "status": "retrieved",
  "publishable": false,
  "provenance": "reference_system",
  "source_ids": ["abs-anzsrc-2020-for-data-cube"],
  "tags": []
}
