{
  "id": "pacific-peoples-society-and-community",
  "record_type": "entity",
  "entity_type": "context_domain",
  "name": "Pacific Peoples society and community",
  "aliases": [],
  "status": "retrieved",
  "publishable": false,
  "provenance": "reference_system",
  "source_ids": ["abs-anzsrc-2020-for-data-cube", "arc-indigenous-studies-for-guide"],
  "tags": [],
  "notes": "ANZSRC Division 45 context domain covering Pacific Peoples society, community, governance, decision making, anthropology, geography, community-based research, and related fields. Pacific Peoples health policy is excluded to group 4516. The 4517 assignment follows the ABS data cube corrected 2025-10-24."
}
