{
  "id": "psychological-methodology-design-and-analysis",
  "record_type": "entity",
  "entity_type": "method",
  "name": "Psychological methodology, design and analysis",
  "aliases": [],
  "status": "retrieved",
  "publishable": false,
  "provenance": "reference_system",
  "source_ids": ["abs-anzsrc-2020-for-data-cube"],
  "tags": [],
  "notes": "ANZSRC statistical research field represented as a method entity rather than a school or therapy."
}
