{
  "id": "pacific-peoples-culture-language-and-history",
  "record_type": "entity",
  "entity_type": "context_domain",
  "name": "Pacific Peoples culture, language and history",
  "aliases": [],
  "status": "retrieved",
  "publishable": false,
  "provenance": "reference_system",
  "source_ids": ["abs-anzsrc-2020-for-data-cube", "arc-indigenous-studies-for-guide"],
  "tags": [],
  "notes": "ANZSRC Division 45 context domain covering Pacific Peoples culture, languages, history, arts, archaeology, design, philosophy, and religion. Pacific Peoples research methods are assigned here by the corrected data cube. Inclusion supplies context for Indigenous psychology; it does not classify the whole domain as a psychology subfield."
}
